[
  {
    "authority_status": "AUTHORITY_SCOPE_MEMBER",
    "biological_id": "HCC1395",
    "genome_build": "GRCh38",
    "known_limits": [
      "Technical datasets are not independent biological replicates.",
      "HCC1395 and HCC1395_DORADO are one biological cell line measured by different technical pipelines."
    ],
    "platform": "ONT_5kHz",
    "scope": "chr1-22",
    "technical_dataset_id": "HCC1395"
  },
  {
    "authority_status": "AUTHORITY_SCOPE_MEMBER",
    "biological_id": "HCC1395",
    "genome_build": "GRCh38",
    "known_limits": [
      "Technical datasets are not independent biological replicates.",
      "HCC1395 and HCC1395_DORADO are one biological cell line measured by different technical pipelines."
    ],
    "platform": "ONT_Dorado",
    "scope": "chr1-22",
    "technical_dataset_id": "HCC1395_DORADO"
  },
  {
    "authority_status": "AUTHORITY_SCOPE_MEMBER",
    "biological_id": "COLO829",
    "genome_build": "GRCh38",
    "known_limits": [
      "Technical datasets are not independent biological replicates.",
      "No independent cellular lineage truth is registered."
    ],
    "platform": "ONT_PAO",
    "scope": "chr1-22",
    "technical_dataset_id": "COLO829"
  },
  {
    "authority_status": "AUTHORITY_SCOPE_MEMBER",
    "biological_id": "H1437",
    "genome_build": "GRCh38",
    "known_limits": [
      "Technical datasets are not independent biological replicates.",
      "No independent cellular lineage truth is registered."
    ],
    "platform": "ONT",
    "scope": "chr1-22",
    "technical_dataset_id": "H1437"
  },
  {
    "authority_status": "AUTHORITY_SCOPE_MEMBER",
    "biological_id": "H2009",
    "genome_build": "GRCh38",
    "known_limits": [
      "Technical datasets are not independent biological replicates.",
      "No independent cellular lineage truth is registered."
    ],
    "platform": "ONT",
    "scope": "chr1-22",
    "technical_dataset_id": "H2009"
  },
  {
    "authority_status": "AUTHORITY_SCOPE_MEMBER",
    "biological_id": "HCC1937",
    "genome_build": "GRCh38",
    "known_limits": [
      "Technical datasets are not independent biological replicates.",
      "No independent cellular lineage truth is registered."
    ],
    "platform": "ONT",
    "scope": "chr1-22",
    "technical_dataset_id": "HCC1937"
  },
  {
    "authority_status": "AUTHORITY_SCOPE_MEMBER",
    "biological_id": "HCC1954",
    "genome_build": "GRCh38",
    "known_limits": [
      "Technical datasets are not independent biological replicates.",
      "No independent cellular lineage truth is registered."
    ],
    "platform": "ONT",
    "scope": "chr1-22",
    "technical_dataset_id": "HCC1954"
  }
]
